,comment,taste,service,mood,cospa,negaposi
67,"初めてレ セゾンを利用させて頂きました。
お料理の味もとても美味しかったですし、
それに加えてスタッフの方々の対応も素晴らしく、これぞ一流のおもてなしだなと感じられたランチタイムでした！幸せな時間を本当にありがとうございました。",5,5,5,5,0.75
68,妻の誕生日のお祝いで今回初めてお世話になりました。一言「最高」でした。独創的なお料理の味や雰囲気ももちろん良かったのですが、一番はスタッフの皆様の接客接遇における愛情というか、思いやりが自然体で表現されていたことがすごく印象的で、これがチームレベルで実現できていることがこのお店の最高の時間と空間を作っている大きな要素だと感じました。お店を出たあとに「凄く良かったねぇ、また行きたいね」と自然と2人の口から同じ言葉が出ました。外資系ホテルやレストランとは少し違う、日本のおもてなしの神髄を体験させて頂きました。ありがとうございました。,4.5,5,5,4.5,0.6666666666666666
69,"生まれてこのかた口コミというものを書いたことがありませんでしたが、お料理・サービスともにあまりに素晴らしかったので、投稿させていただきます。
父の誕生日祝いのため、家族で伺いました。お恥ずかしながら、こういった格式あるレストランに行くのは初めてで、しかも帝国ホテルということで緊張しておりましたが、スタッフのみなさんの温かい心配り（と、ほんの少しのアルコール笑）ですぐに緊張もほぐれました。
お料理がおいしかったのはもちろんですが、記念撮影や誕生日ケーキ、四つ葉のクローバーまでいただいて、まさに至れり尽くせり。他にも挙げたらきりがないのですが、スタッフ皆さんが対「お客さん」というより対「人」として接してくださっているなと。ああ、これが一流のサービスなのか！と感動しました。
あとはもう、何より、父が本当に喜んでくれたのが一番です。夢のような時間をありがとうございました。また大切な日に伺いたいです。",5,5,5,5,0.6363636363636364
